{
  "$schema_file": "../schemas/approved-handoff.schema.json",
  "schema": "approved_handoff",
  "schema_version": "0.1",
  "project": "devswitchboard",
  "task_id": "devswitchboard-reroute-recovery-007",
  "revision": 2,
  "status": "ready_for_codex_preflight",
  "task_class": "architectural",
  "goal": "Make the Re-route Required lifecycle normatively enforceable while preserving valid Revision 1 checkpoint evidence.",
  "baseline": {
    "state": "initialized",
    "github_remote_available": true,
    "local_repository_available": true
  },
  "context": {
    "depth": "high",
    "freshness": "fresh",
    "local_delta_required": false
  },
  "workflow_state": {
    "requirement_discovery": "completed",
    "design": "completed",
    "specification": "completed",
    "developer_approval": true
  },
  "superpowers": {
    "brainstorming": {
      "satisfied_upstream": true,
      "source": "DevSwitchboard Dogfood #007 Approved Handoff Revision 2"
    }
  },
  "routing": {
    "codex_preflight": {
      "active": true
    },
    "implementation_planning": {
      "active": true,
      "owner": "codex"
    },
    "implementation": {
      "owner": "codex",
      "subagents": false
    },
    "review": {
      "active": true,
      "subagent": true
    },
    "verification": {
      "active": true
    }
  },
  "execution": {
    "isolation": {
      "recommended": true
    },
    "methodology": {
      "adapter": "superpowers",
      "path": "architectural"
    }
  },
  "developer_decisions": {
    "routing_recommendation_approved": true,
    "implementation_subagents": false,
    "workspace_isolation": true
  },
  "confidence": "high",
  "task_profile": {
    "$schema_file": "../schemas/task-profile.schema.json",
    "schema": "task_profile",
    "schema_version": "0.1",
    "profile_status": "final",
    "dimensions": {
      "requirement_ambiguity": {
        "level": "low",
        "evidence": [
          "Revision 2 explicitly approves normative pending, supersession, resumption, and conflict-distinction behavior."
        ]
      },
      "scope_complexity": {
        "level": "high",
        "evidence": [
          "The change coordinates routing rules, contract guidance, cross-record verifier behavior, regression fixtures, lifecycle examples, and Dogfood evidence."
        ]
      },
      "repository_dependency": {
        "level": "high",
        "evidence": [
          "Correct enforcement depends on the live verifier record walk, schema fields, canonical fixture conventions, and regression harness."
        ]
      },
      "regression_risk": {
        "level": "high",
        "evidence": [
          "Incorrect relational enforcement could permit unresolved strategy-dependent work or permanently block valid approved revisions."
        ]
      },
      "parallelizability": {
        "level": "low",
        "evidence": [
          "Record identity, approval provenance, verifier branches, fixtures, and documentation share one semantic integrity boundary."
        ]
      },
      "security_sensitivity": {
        "level": "low",
        "evidence": [
          "The task changes workflow integrity rather than privileged runtime or sensitive data behavior."
        ]
      },
      "context_uncertainty": {
        "level": "low",
        "evidence": [
          "The accepted checkpoint, approved Revision 2 intent, and current repository expose all affected records and enforcement paths."
        ]
      }
    }
  },
  "completed_gates": [
    {
      "gate": "requirement_discovery",
      "status": "reused",
      "evidence_source": "DevSwitchboard Dogfood #007 Approved Handoff Revision 1"
    },
    {
      "gate": "design",
      "status": "reused",
      "evidence_source": "Revision 1 explanatory design remains compatible with normative enforcement"
    },
    {
      "gate": "specification",
      "status": "approved",
      "evidence_source": "DevSwitchboard Dogfood #007 Approved Handoff Revision 2"
    },
    {
      "gate": "re_route_required",
      "status": "approved",
      "evidence_source": "dogfood/devswitchboard-reroute-recovery-007-re-route-required.json"
    },
    {
      "gate": "workspace_isolation",
      "status": "reused",
      "evidence_source": "Existing codex/dogfood-007-reroute-recovery worktree"
    }
  ],
  "approved_strategy": {
    "implementation_subagents": false,
    "workspace_isolation": true,
    "review_subagent": true,
    "methodology_adapter": "superpowers"
  },
  "scope": {
    "included": [
      "Relational Re-route Required semantic verifier enforcement",
      "Regression-first pending, invalid-continuation, approved-resume, provenance, silent-adaptation, and conflict-distinction coverage",
      "Canonical lifecycle records, normative documentation, dedicated review, and Dogfood #007 evidence"
    ],
    "excluded": [
      "Schema-version migration",
      "CLI, plugin, Skill, MCP, probabilistic routing, new bridge artifacts, and publication"
    ]
  },
  "acceptance_criteria": [
    "Pending Re-route Required permits only matching waiting-for-developer approval state.",
    "Strategy-dependent active or complete state fails before approved supersession.",
    "A provenance-linked approved replacement revision permits resumed work without deleting historical evidence.",
    "Silent route invalidation and intent-infeasibility masquerading as re-route fail semantic verification.",
    "Dedicated review and fresh verification pass after all remediations."
  ],
  "verification_expectations": [
    "Focused red-green lifecycle regressions",
    "Complete workflow-integrity regressions and repository verifier",
    "JSON, schema conformance, semantic invariants, Markdown links, terminology, unresolved markers, and Git whitespace",
    "Exact final task inventory and complete Work State"
  ],
  "readiness": {
    "intent_clear": "pass",
    "material_decisions_resolved": "pass",
    "scope_bounded": "pass",
    "acceptance_testable": "pass",
    "critical_uncertainty": "none",
    "unresolved_conflicts": "none",
    "developer_approval": true
  }
}
