{
  "$schema_file": "../schemas/approved-handoff.schema.json",
  "schema": "approved_handoff",
  "schema_version": "0.1",
  "project": "devswitchboard",
  "task_id": "devswitchboard-conflict-recovery-008",
  "revision": 2,
  "status": "ready_for_codex_preflight",
  "task_class": "architectural",
  "goal": "Resolve the Dogfood #008 intent conflict by preserving the machine-enforcement goal, superseding the documentation-only restriction, and normatively enforcing the Conflict Report pause-and-resume lifecycle.",
  "baseline": {
    "state": "initialized",
    "github_remote_available": true,
    "local_repository_available": true
  },
  "context": {
    "depth": "high",
    "freshness": "fresh",
    "local_delta_required": false
  },
  "workflow_state": {
    "requirement_discovery": "completed",
    "design": "completed",
    "specification": "completed",
    "developer_approval": true
  },
  "superpowers": {
    "brainstorming": {
      "satisfied_upstream": true,
      "source": "DevSwitchboard Dogfood #008 Approved Handoff Revision 2"
    }
  },
  "routing": {
    "codex_preflight": {
      "active": true
    },
    "implementation_planning": {
      "active": true,
      "owner": "codex"
    },
    "implementation": {
      "owner": "codex",
      "subagents": false
    },
    "review": {
      "active": true,
      "subagent": true
    },
    "verification": {
      "active": true
    }
  },
  "execution": {
    "isolation": {
      "recommended": true
    },
    "methodology": {
      "adapter": "superpowers",
      "path": "architectural"
    }
  },
  "developer_decisions": {
    "routing_recommendation_approved": true,
    "implementation_subagents": false,
    "workspace_isolation": true
  },
  "confidence": "high",
  "task_profile": {
    "$schema_file": "../schemas/task-profile.schema.json",
    "schema": "task_profile",
    "schema_version": "0.1",
    "profile_status": "final",
    "dimensions": {
      "requirement_ambiguity": {
        "level": "low",
        "evidence": [
          "The developer explicitly selected Conflict Report option A: preserve machine enforcement and supersede the documentation-only restriction."
        ]
      },
      "scope_complexity": {
        "level": "high",
        "evidence": [
          "The revised task coordinates Conflict Report lifecycle semantics, cross-record verifier behavior, regression coverage, normative documentation, recovery state, and Dogfood evidence."
        ]
      },
      "repository_dependency": {
        "level": "high",
        "evidence": [
          "Correct enforcement depends on the live verifier record walk, Work State representation, Approved Handoff provenance, Conflict Report schema, and existing lifecycle enforcement introduced by Dogfood #007."
        ]
      },
      "regression_risk": {
        "level": "high",
        "evidence": [
          "Incorrect enforcement could allow strategy-dependent mutation during an unresolved intent conflict or permanently block a legitimately approved intent revision."
        ]
      },
      "parallelizability": {
        "level": "low",
        "evidence": [
          "Conflict association, authority resolution, Work State semantics, verifier predicates, and regression fixtures share one lifecycle integrity boundary."
        ]
      },
      "security_sensitivity": {
        "level": "low",
        "evidence": [
          "The change affects workflow integrity rather than privileged runtime behavior, secrets, or sensitive data handling."
        ]
      },
      "context_uncertainty": {
        "level": "low",
        "evidence": [
          "The validated Conflict Report checkpoint, blocked Work State, live feasibility evidence, current remote baseline, and explicit developer resolution provide the material context needed for Revision 2."
        ]
      }
    }
  },
  "completed_gates": [
    {
      "gate": "requirement_discovery",
      "status": "reused",
      "evidence_source": "DevSwitchboard Dogfood #008 Approved Handoff Revision 1"
    },
    {
      "gate": "design",
      "status": "reused",
      "evidence_source": "Revision 1 conflict decision aid and feasibility distinction remain valid"
    },
    {
      "gate": "conflict_report",
      "status": "approved",
      "evidence_source": "dogfood/devswitchboard-conflict-recovery-008-conflict-report.json"
    },
    {
      "gate": "specification",
      "status": "approved",
      "evidence_source": "DevSwitchboard Dogfood #008 Approved Handoff Revision 2"
    },
    {
      "gate": "workspace_isolation",
      "status": "reused",
      "evidence_source": "Existing codex/dogfood-008-conflict-recovery worktree"
    }
  ],
  "approved_strategy": {
    "implementation_subagents": false,
    "workspace_isolation": true,
    "review_subagent": true,
    "methodology_adapter": "superpowers"
  },
  "scope": {
    "included": [
      "Normative Conflict Report pending, blocking, resolution, and approved-resume lifecycle semantics",
      "Cross-record semantic verifier enforcement for Conflict Report and Work State",
      "Regression-first coverage for unresolved conflicts, invalid continuation, valid developer-approved intent revision, provenance, authority ambiguity, and historical conflict evidence",
      "Necessary normative contract, routing, state-and-recovery, example, and Dogfood #008 documentation",
      "Persisted Revision 2 authority, repository-grounded implementation plan, dedicated fresh review, remediation, and fresh verification"
    ],
    "excluded": [
      "The Revision 1 documentation-only restriction, which is explicitly superseded by this developer-approved intent revision",
      "Schema-version migration unless a new material event proves it necessary",
      "CLI, plugin, Skill, MCP integration, new methodology adapters, probabilistic routing, new bridge artifact types, releases, tags, packages, Pages, and unrelated publication"
    ]
  },
  "acceptance_criteria": [
    "A pending Conflict Report requires a matching blocked-by-conflict resumable state and cannot coexist with strategy-dependent active or complete execution.",
    "While a conflict is unresolved, the next safe action is non-mutating and developer-decision-oriented.",
    "An unrelated task, unapproved revision, or approval without exact Conflict Report provenance cannot resolve the conflict.",
    "A unique developer-approved later intent revision linked to the exact Conflict Report may resolve the conflict and allow execution to resume.",
    "Historical Conflict Report and blocked Work State evidence remain canonical after resolution and do not become permanent blockers.",
    "Ambiguous highest replacement authority is rejected rather than guessed.",
    "Conflict Report remains reserved for intent-versus-feasibility incompatibility and is not used for ordinary route changes, environment failures, or recoverable verification failures.",
    "Dogfood #008 resumes from the preserved blocked checkpoint rather than restarting requirement discovery or brainstorming.",
    "Dedicated fresh review reports no remaining Critical or Important findings after remediation.",
    "Fresh final repository verification passes after the final change."
  ],
  "verification_expectations": [
    "Regression-first RED then GREEN coverage for the Conflict Report lifecycle",
    "Complete workflow-integrity regression suite",
    "Full repository verifier",
    "JSON parsing, schema conformance, semantic invariants, routing, terminology, Markdown links, unresolved markers, and decision-value checks",
    "Git whitespace and exact final task inventory checks",
    "Fresh verification after all reviewer-driven remediation"
  ],
  "readiness": {
    "intent_clear": "pass",
    "material_decisions_resolved": "pass",
    "scope_bounded": "pass",
    "acceptance_testable": "pass",
    "critical_uncertainty": "none",
    "unresolved_conflicts": "none",
    "developer_approval": true
  }
}
